{
  "$schema": "https://json-schema.org/draft/2020-12/schema",
  "$id": "https://raw.githubusercontent.com/KanadeK/seed-sleuth/main/schemas/world.schema.json",
  "title": "SeedSleuth world",
  "type": "object",
  "additionalProperties": false,
  "required": ["format", "schemaVersion", "seed", "width", "height", "cells"],
  "properties": {
    "format": {
      "const": "seed-sleuth-world"
    },
    "schemaVersion": {
      "const": 1
    },
    "seed": {
      "type": ["integer", "null"]
    },
    "width": {
      "type": "integer",
      "minimum": 1
    },
    "height": {
      "type": "integer",
      "minimum": 1
    },
    "cells": {
      "type": "array",
      "items": {
        "type": "string"
      },
      "minItems": 1
    },
    "metadata": {
      "type": "object"
    }
  }
}
